{
  "version": 1,
  "generatedAt": "2026-03-29T17:47:02Z",
  "purpose": "Define what OpenCompliance publishes publicly versus privately for the first U.S. sector-regime depth wave.",
  "frameworkPolicies": [
    {
      "framework": "HIPAA Privacy Rule",
      "sourceAvailability": "public_exact_feasible",
      "publicAllowed": [
        "reviewed CFR-section anchors",
        "public-control mappings",
        "typed claim contracts",
        "documentary and rights-workflow boundary notes"
      ],
      "privateAllowed": [
        "working decomposition notes",
        "non-public legal commentary"
      ],
      "publicBlocked": [
        "claiming that all HIPAA Privacy obligations are mechanised or fully satisfied by the current documentary corridor"
      ]
    },
    {
      "framework": "HIPAA Breach Notification Rule",
      "sourceAvailability": "public_exact_feasible",
      "publicAllowed": [
        "reviewed CFR-section anchors",
        "breach-governance and escalation mappings",
        "typed runbook and escalation attestations"
      ],
      "privateAllowed": [
        "incident tabletop notes",
        "operator-specific breach playbooks"
      ],
      "publicBlocked": [
        "claiming that a current runbook proves timely and complete notification performance in every real incident"
      ]
    },
    {
      "framework": "GLBA Safeguards Rule",
      "sourceAvailability": "public_exact_feasible",
      "publicAllowed": [
        "reviewed CFR-section anchors",
        "technical subset mappings for MFA, logging, encryption, vendor oversight, incident response, and disposal"
      ],
      "privateAllowed": [
        "implementation-specific residual-risk notes",
        "non-public control-design discussion"
      ],
      "publicBlocked": [
        "claiming that the current narrow technical overlap equals a full Safeguards Rule program"
      ]
    },
    {
      "framework": "NYDFS 23 NYCRR Part 500",
      "sourceAvailability": "public_exact_feasible",
      "publicAllowed": [
        "reviewed regulation-section anchors",
        "security, notice, and third-party-policy mappings"
      ],
      "privateAllowed": [
        "exam-ready evidentiary packages",
        "covered-entity scoping notes"
      ],
      "publicBlocked": [
        "claiming that current overlap resolves covered-entity scoping, exemptions, or certification responsibilities"
      ]
    },
    {
      "framework": "CCPA/CPRA",
      "sourceAvailability": "public_exact_feasible",
      "publicAllowed": [
        "reviewed statutory anchors",
        "rights-handling, retention, and service-provider contract mappings"
      ],
      "privateAllowed": [
        "internal rights-operating-model notes",
        "non-public policy drafts"
      ],
      "publicBlocked": [
        "claiming that the current corridor resolves the whole California privacy-law compliance programme"
      ]
    }
  ],
  "workflow": [
    {
      "step": 1,
      "name": "Choose the narrow overlap worth publishing",
      "output": "A regime-specific control list with explicit proof, attestation, and judgment boundaries"
    },
    {
      "step": 2,
      "name": "Review public exact anchors",
      "output": "A public exact-anchor layer that cites the authoritative section without importing non-public text"
    },
    {
      "step": 3,
      "name": "Attach typed evidence contracts",
      "output": "Typed claims and fixture or operator evidence shapes for the mapped controls"
    },
    {
      "step": 4,
      "name": "Publish only the publication-safe slice",
      "output": "Public status, review, and artifact files that keep remaining gaps explicit"
    }
  ]
}
